<?xml version="1.0" encoding="UTF-8"?>
<xs:schema xmlns:xs="http://www.w3.org/2001/XMLSchema">

    <xs:complexType name="contact_type">
        <xs:sequence>
            <xs:element name="name" type="xs:string" />
            <xs:element name="phone" type="xs:int" />
            <xs:element name="address">
                <xs:complexType>
                    <xs:sequence>
                        <xs:element name="street" type="xs:string" />
                        <xs:element name="number" type="xs:int" />
                        <xs:element name="city" type="xs:string" />
                        <xs:element name="country" type="xs:string" />
                        <xs:choice minOccurs="1" maxOccurs="1">
                            <xs:element name="zip" type="xs:int" />
                            <xs:element name="cedex" type="xs:int" />
                        </xs:choice>
                    </xs:sequence>
                </xs:complexType>
            </xs:element>
        </xs:sequence>
    </xs:complexType>

    <xs:element name="person">
        <xs:complexType>
            <xs:complexContent>
                <xs:extension base="contact_type">
                    <xs:sequence>
                        <xs:element name="firstname" type="xs:string"/>
                    </xs:sequence>
                </xs:extension>
            </xs:complexContent>
        </xs:complexType>
    </xs:element>

    <xs:element name="company">
        <xs:complexType>
            <xs:complexContent>
                <xs:extension base="contact_type" />
            </xs:complexContent>
        </xs:complexType>
    </xs:element>

    <xs:element name="contacts">
        <xs:complexType>
            <xs:choice maxOccurs="unbounded">
                <xs:element ref="person"/>
                <xs:element ref="company"/>
            </xs:choice>
        </xs:complexType>
    </xs:element>
</xs:schema>